{
  "schema_version": "1.0",
  "identity": {
    "internal_job_id": "job-1232",
    "source_job_id": "freep-88198",
    "canonical_url": "https://www.freep.nl/opdracht/88198",
    "source": "freep"
  },
  "core": {
    "title": "QA Engineer",
    "client_name": "Atos",
    "description_original": "QA Engineer, status kon niet eenduidig worden vastgesteld.",
    "description_clean": "QA Engineer, status could not be determined unambiguously."
  },
  "publication": {
    "publication_datetime": "2025-09-20T09:00:00+02:00",
    "closing_datetime": null,
    "timezone": "Europe/Amsterdam",
    "status": "unknown"
  },
  "delivery": {
    "location": "Rabat, Morocco",
    "remote_policy": "hybrid",
    "hours_min": 32,
    "hours_max": 40,
    "start_date": null,
    "end_date": null,
    "extension_options": null
  },
  "selection": {
    "hard_requirements": [],
    "wishes": [],
    "award_criteria": [],
    "competencies": []
  },
  "profile": {
    "education": [],
    "experience": [],
    "skills": [],
    "methods": [],
    "certifications": [],
    "languages": [
      "English"
    ]
  },
  "commercial": {
    "rate_min": null,
    "rate_max": null,
    "currency": "EUR",
    "vat_basis": null,
    "travel_cost_policy": null
  },
  "engagement": {
    "contract_type": "freelance",
    "zzp_allowed": true,
    "screening": null,
    "vog": null,
    "nationality_constraints": null,
    "supplier_conditions": null
  },
  "procedure": {
    "positions": 1,
    "max_candidates": null,
    "interview_window": null,
    "submission_instructions": null
  },
  "quality": {
    "completeness_status": "incomplete",
    "validation_errors": [
      "Conflicting status signals between route A and route B"
    ],
    "source_evidence": [],
    "confidence_per_field": null
  },
  "version": {
    "first_seen_at": "2025-09-20T09:00:00+02:00",
    "last_seen_at": "2025-09-23T10:00:00+02:00",
    "changed_at": "2025-09-23T10:00:00+02:00",
    "content_hash": "sha256:1232f2a3b4",
    "record_version": 2,
    "observation_state": "active"
  },
  "attachments": [],
  "change_type": "uncertain"
}
