{
  "schema_version": "1.0",
  "identity": {
    "internal_job_id": "job-1299",
    "source_job_id": "freep-88299",
    "canonical_url": "https://www.freep.nl/opdracht/88299",
    "source": "freep"
  },
  "core": {
    "title": "Unknown Role",
    "client_name": null,
    "description_original": null,
    "description_clean": null
  },
  "publication": {
    "publication_datetime": null,
    "closing_datetime": null,
    "timezone": "Europe/Amsterdam",
    "status": "unknown"
  },
  "delivery": {
    "location": null,
    "remote_policy": null,
    "hours_min": null,
    "hours_max": null,
    "start_date": null,
    "end_date": null,
    "extension_options": null
  },
  "selection": {
    "hard_requirements": [],
    "wishes": [],
    "award_criteria": [],
    "competencies": []
  },
  "profile": {
    "education": [],
    "experience": [],
    "skills": [],
    "methods": [],
    "certifications": [],
    "languages": []
  },
  "commercial": {
    "rate_min": null,
    "rate_max": null,
    "currency": null,
    "vat_basis": null,
    "travel_cost_policy": null
  },
  "engagement": {
    "contract_type": null,
    "zzp_allowed": null,
    "screening": null,
    "vog": null,
    "nationality_constraints": null,
    "supplier_conditions": null
  },
  "procedure": {
    "positions": null,
    "max_candidates": null,
    "interview_window": null,
    "submission_instructions": null
  },
  "quality": {
    "completeness_status": "incomplete",
    "validation_errors": [
      "missing required field: description_original",
      "missing required field: company"
    ],
    "source_evidence": [],
    "confidence_per_field": null
  },
  "version": {
    "first_seen_at": "2025-09-27T10:00:00+02:00",
    "last_seen_at": "2025-09-27T10:00:00+02:00",
    "changed_at": null,
    "content_hash": "sha256:1299f0e1d2",
    "record_version": 1,
    "observation_state": "active"
  },
  "attachments": [],
  "change_type": "uncertain"
}
