{
  "schema_version": "1.0",
  "identity": {
    "internal_job_id": "job-1243",
    "source_job_id": "freep-88209",
    "canonical_url": "https://www.freep.nl/opdracht/88209",
    "source": "freep"
  },
  "core": {
    "title": "ML Engineer",
    "client_name": "Orange",
    "description_original": "ML Engineer voor productie-modellen.",
    "description_clean": "ML Engineer for production models."
  },
  "publication": {
    "publication_datetime": "2025-09-27T13:22:00+02:00",
    "closing_datetime": "2025-10-11T23:59:00+02:00",
    "timezone": "Europe/Amsterdam",
    "status": "open"
  },
  "delivery": {
    "location": "Rabat, Morocco",
    "remote_policy": "hybrid",
    "hours_min": 32,
    "hours_max": 40,
    "start_date": null,
    "end_date": null,
    "extension_options": null
  },
  "selection": {
    "hard_requirements": [
      {
        "text": "Minimaal 4 jaar ervaring met MLOps",
        "evidence_ref": "src-1243-1"
      }
    ],
    "wishes": [
      {
        "text": "Kubernetes ervaring is een pre",
        "evidence_ref": "src-1243-2"
      }
    ],
    "award_criteria": [
      {
        "text": "CV (70%)",
        "evidence_ref": "src-1243-3"
      },
      {
        "text": "Interview (30%)",
        "evidence_ref": "src-1243-4"
      }
    ],
    "competencies": []
  },
  "profile": {
    "education": [],
    "experience": [],
    "skills": [
      "MLOps",
      "Kubernetes",
      "Docker"
    ],
    "methods": [],
    "certifications": [],
    "languages": [
      "English"
    ]
  },
  "commercial": {
    "rate_min": 75,
    "rate_max": 100,
    "currency": "EUR",
    "vat_basis": null,
    "travel_cost_policy": null
  },
  "engagement": {
    "contract_type": "freelance",
    "zzp_allowed": true,
    "screening": null,
    "vog": null,
    "nationality_constraints": null,
    "supplier_conditions": null
  },
  "procedure": {
    "positions": 1,
    "max_candidates": null,
    "interview_window": null,
    "submission_instructions": null
  },
  "quality": {
    "completeness_status": "complete_within_scan_window",
    "validation_errors": [],
    "source_evidence": [
      "src-1243-1",
      "src-1243-2",
      "src-1243-3",
      "src-1243-4"
    ],
    "confidence_per_field": null
  },
  "version": {
    "first_seen_at": "2025-09-27T13:22:00+02:00",
    "last_seen_at": "2025-09-27T13:22:00+02:00",
    "changed_at": null,
    "content_hash": "sha256:1243e5f6a7",
    "record_version": 1,
    "observation_state": "active"
  },
  "attachments": [],
  "change_type": "new"
}
