{
  "schema_version": "1.0",
  "identity": {
    "internal_job_id": "job-1241",
    "source_job_id": "freep-88207",
    "canonical_url": "https://www.freep.nl/opdracht/88207",
    "source": "freep"
  },
  "core": {
    "title": "DevOps Engineer",
    "client_name": "Atos",
    "description_original": "DevOps Engineer opdracht is gesloten.",
    "description_clean": "DevOps Engineer assignment, now closed."
  },
  "publication": {
    "publication_datetime": "2025-09-01T09:00:00+02:00",
    "closing_datetime": "2025-09-26T18:45:00+02:00",
    "timezone": "Europe/Amsterdam",
    "status": "closed"
  },
  "delivery": {
    "location": "Casablanca, Morocco",
    "remote_policy": "hybrid",
    "hours_min": 32,
    "hours_max": 40,
    "start_date": null,
    "end_date": null,
    "extension_options": null
  },
  "selection": {
    "hard_requirements": [],
    "wishes": [],
    "award_criteria": [],
    "competencies": []
  },
  "profile": {
    "education": [],
    "experience": [],
    "skills": [],
    "methods": [],
    "certifications": [],
    "languages": [
      "English"
    ]
  },
  "commercial": {
    "rate_min": null,
    "rate_max": null,
    "currency": "EUR",
    "vat_basis": null,
    "travel_cost_policy": null
  },
  "engagement": {
    "contract_type": "freelance",
    "zzp_allowed": true,
    "screening": null,
    "vog": null,
    "nationality_constraints": null,
    "supplier_conditions": null
  },
  "procedure": {
    "positions": 1,
    "max_candidates": null,
    "interview_window": null,
    "submission_instructions": null
  },
  "quality": {
    "completeness_status": "complete_within_scan_window",
    "validation_errors": [],
    "source_evidence": [],
    "confidence_per_field": null
  },
  "version": {
    "first_seen_at": "2025-09-01T09:00:00+02:00",
    "last_seen_at": "2025-09-26T18:45:00+02:00",
    "changed_at": "2025-09-26T18:45:00+02:00",
    "content_hash": "sha256:1241a7b8c9",
    "record_version": 2,
    "observation_state": "closed"
  },
  "attachments": [],
  "change_type": "closed"
}
