{
  "schema_version": "1.0",
  "identity": {
    "internal_job_id": "job-1240",
    "source_job_id": "freep-88206",
    "canonical_url": "https://www.freep.nl/opdracht/88206",
    "source": "freep"
  },
  "core": {
    "title": "Data Analyst",
    "client_name": "Schneider Electric",
    "description_original": "Data Analyst gezocht voor energieproject.",
    "description_clean": "Data Analyst needed for an energy sector project."
  },
  "publication": {
    "publication_datetime": "2025-09-26T12:31:00+02:00",
    "closing_datetime": "2025-10-08T23:59:00+02:00",
    "timezone": "Europe/Amsterdam",
    "status": "open"
  },
  "delivery": {
    "location": "Rabat, Morocco",
    "remote_policy": "hybrid",
    "hours_min": 32,
    "hours_max": 40,
    "start_date": null,
    "end_date": null,
    "extension_options": null
  },
  "selection": {
    "hard_requirements": [
      {
        "text": "Minimaal 3 jaar ervaring met data-analyse",
        "evidence_ref": "src-1240-1"
      }
    ],
    "wishes": [],
    "award_criteria": [],
    "competencies": []
  },
  "profile": {
    "education": [],
    "experience": [],
    "skills": [
      "SQL",
      "Excel"
    ],
    "methods": [],
    "certifications": [],
    "languages": [
      "English"
    ]
  },
  "commercial": {
    "rate_min": null,
    "rate_max": null,
    "currency": "EUR",
    "vat_basis": null,
    "travel_cost_policy": null
  },
  "engagement": {
    "contract_type": "freelance",
    "zzp_allowed": true,
    "screening": null,
    "vog": null,
    "nationality_constraints": null,
    "supplier_conditions": null
  },
  "procedure": {
    "positions": 1,
    "max_candidates": null,
    "interview_window": null,
    "submission_instructions": null
  },
  "quality": {
    "completeness_status": "complete_within_scan_window",
    "validation_errors": [],
    "source_evidence": [
      "src-1240-1"
    ],
    "confidence_per_field": null
  },
  "version": {
    "first_seen_at": "2025-09-26T12:31:00+02:00",
    "last_seen_at": "2025-09-26T12:31:00+02:00",
    "changed_at": null,
    "content_hash": "sha256:1240b8c9d0",
    "record_version": 1,
    "observation_state": "active"
  },
  "attachments": [],
  "change_type": "new"
}
