{
  "schema_version": "1.0",
  "identity": {
    "internal_job_id": "job-1244",
    "source_job_id": "freep-88210",
    "canonical_url": "https://www.freep.nl/opdracht/88210",
    "source": "freep"
  },
  "core": {
    "title": "Data Scientist",
    "client_name": "BNP Paribas",
    "description_original": "Data Scientist functie is vervuld / gesloten.",
    "description_clean": "Data Scientist position, now closed."
  },
  "publication": {
    "publication_datetime": "2025-09-10T09:00:00+02:00",
    "closing_datetime": "2025-09-27T16:40:00+02:00",
    "timezone": "Europe/Amsterdam",
    "status": "closed"
  },
  "delivery": {
    "location": "Casablanca, Morocco",
    "remote_policy": "hybrid",
    "hours_min": 32,
    "hours_max": 40,
    "start_date": null,
    "end_date": null,
    "extension_options": null
  },
  "selection": {
    "hard_requirements": [
      {
        "text": "Minimaal 5 jaar ervaring met machine learning",
        "evidence_ref": "src-1244-1"
      }
    ],
    "wishes": [],
    "award_criteria": [],
    "competencies": []
  },
  "profile": {
    "education": [],
    "experience": [],
    "skills": [
      "Python",
      "scikit-learn"
    ],
    "methods": [],
    "certifications": [],
    "languages": [
      "English"
    ]
  },
  "commercial": {
    "rate_min": null,
    "rate_max": null,
    "currency": "EUR",
    "vat_basis": null,
    "travel_cost_policy": null
  },
  "engagement": {
    "contract_type": "freelance",
    "zzp_allowed": true,
    "screening": null,
    "vog": null,
    "nationality_constraints": null,
    "supplier_conditions": null
  },
  "procedure": {
    "positions": 1,
    "max_candidates": null,
    "interview_window": null,
    "submission_instructions": null
  },
  "quality": {
    "completeness_status": "complete_within_scan_window",
    "validation_errors": [],
    "source_evidence": [
      "src-1244-1"
    ],
    "confidence_per_field": null
  },
  "version": {
    "first_seen_at": "2025-09-10T09:00:00+02:00",
    "last_seen_at": "2025-09-27T16:40:00+02:00",
    "changed_at": "2025-09-27T16:40:00+02:00",
    "content_hash": "sha256:1244d4e5f6",
    "record_version": 3,
    "observation_state": "closed"
  },
  "attachments": [],
  "change_type": "closed"
}
