{
  "schema_version": "1.0",
  "identity": {
    "internal_job_id": "job-1247",
    "source_job_id": "freep-88213",
    "canonical_url": "https://www.freep.nl/opdracht/88213",
    "source": "freep"
  },
  "core": {
    "title": "Data Analyst",
    "client_name": "Accenture",
    "description_original": "Wij zoeken een ervaren Data Analyst voor een langdurig traject bij een internationale klant.",
    "description_clean": "We are looking for an experienced Data Analyst for a long-term assignment with an international client."
  },
  "publication": {
    "publication_datetime": "2025-09-28T14:32:00+02:00",
    "closing_datetime": "2025-10-12T23:59:00+02:00",
    "timezone": "Europe/Amsterdam",
    "status": "open"
  },
  "delivery": {
    "location": "Rabat, Morocco",
    "remote_policy": "hybrid",
    "hours_min": 32,
    "hours_max": 40,
    "start_date": "2025-10-20",
    "end_date": "2026-04-20",
    "extension_options": "2 x 6 months"
  },
  "selection": {
    "hard_requirements": [
      { "text": "Minimaal 5 jaar ervaring met data-analyse", "evidence_ref": "src-1247-1" },
      { "text": "Kennis van SQL en Python", "evidence_ref": "src-1247-2" }
    ],
    "wishes": [
      { "text": "Ervaring met Power BI is een pre", "evidence_ref": "src-1247-3" }
    ],
    "award_criteria": [
      { "text": "CV en motivatie (60%)", "evidence_ref": "src-1247-4" },
      { "text": "Interview (40%)", "evidence_ref": "src-1247-5" }
    ],
    "competencies": [
      { "text": "Analytisch vermogen", "evidence_ref": "src-1247-6" }
    ]
  },
  "profile": {
    "education": ["Bachelor in Computer Science or equivalent"],
    "experience": ["5+ years in data analysis"],
    "skills": ["SQL", "Python", "Power BI"],
    "methods": ["Agile/Scrum"],
    "certifications": [],
    "languages": ["English", "Dutch"]
  },
  "commercial": {
    "rate_min": 65,
    "rate_max": 85,
    "currency": "EUR",
    "vat_basis": "excl. VAT",
    "travel_cost_policy": "not reimbursed"
  },
  "engagement": {
    "contract_type": "freelance",
    "zzp_allowed": true,
    "screening": "standard",
    "vog": true,
    "nationality_constraints": null,
    "supplier_conditions": "General Terms and Conditions apply"
  },
  "procedure": {
    "positions": 1,
    "max_candidates": 3,
    "interview_window": "2025-10-06 to 2025-10-10",
    "submission_instructions": "Submit CV in English, max 5 pages"
  },
  "quality": {
    "completeness_status": "complete_within_scan_window",
    "validation_errors": [],
    "source_evidence": ["src-1247-1", "src-1247-2", "src-1247-3", "src-1247-4", "src-1247-5", "src-1247-6"],
    "confidence_per_field": { "title": 0.99, "client_name": 0.97, "location": 0.95 }
  },
  "version": {
    "first_seen_at": "2025-09-28T14:32:00+02:00",
    "last_seen_at": "2025-09-28T14:32:00+02:00",
    "changed_at": null,
    "content_hash": "sha256:1247a1b2c3",
    "record_version": 1,
    "observation_state": "active"
  },
  "attachments": [],
  "change_type": "new"
}
