{
  "schema_version": "1.0",
  "identity": {
    "internal_job_id": "job-1246",
    "source_job_id": "freep-88212",
    "canonical_url": "https://www.freep.nl/opdracht/88212",
    "source": "freep"
  },
  "core": {
    "title": "Data Engineer",
    "client_name": "Capgemini",
    "description_original": "Ervaren Data Engineer gezocht voor cloud data platform.",
    "description_clean": "Experienced Data Engineer needed for a cloud data platform."
  },
  "publication": {
    "publication_datetime": "2025-09-28T12:17:00+02:00",
    "closing_datetime": "2025-10-10T23:59:00+02:00",
    "timezone": "Europe/Amsterdam",
    "status": "open"
  },
  "delivery": {
    "location": "Casablanca, Morocco",
    "remote_policy": "hybrid",
    "hours_min": 32,
    "hours_max": 40,
    "start_date": null,
    "end_date": null,
    "extension_options": null
  },
  "selection": {
    "hard_requirements": [
      {
        "text": "Minimaal 4 jaar ervaring met Spark en Airflow",
        "evidence_ref": "src-1246-1"
      }
    ],
    "wishes": [
      {
        "text": "Ervaring met Databricks is een pre",
        "evidence_ref": "src-1246-2"
      }
    ],
    "award_criteria": [
      {
        "text": "CV en motivatie (50%)",
        "evidence_ref": "src-1246-3"
      },
      {
        "text": "Interview (50%)",
        "evidence_ref": "src-1246-4"
      }
    ],
    "competencies": [
      {
        "text": "Probleemoplossend vermogen",
        "evidence_ref": "src-1246-5"
      }
    ]
  },
  "profile": {
    "education": [],
    "experience": [],
    "skills": [
      "Spark",
      "Airflow",
      "Databricks"
    ],
    "methods": [],
    "certifications": [],
    "languages": [
      "English",
      "French"
    ]
  },
  "commercial": {
    "rate_min": 70,
    "rate_max": 95,
    "currency": "EUR",
    "vat_basis": "excl. VAT",
    "travel_cost_policy": null
  },
  "engagement": {
    "contract_type": "freelance",
    "zzp_allowed": true,
    "screening": null,
    "vog": null,
    "nationality_constraints": null,
    "supplier_conditions": null
  },
  "procedure": {
    "positions": 1,
    "max_candidates": null,
    "interview_window": null,
    "submission_instructions": null
  },
  "quality": {
    "completeness_status": "complete_within_scan_window",
    "validation_errors": [],
    "source_evidence": [
      "src-1246-1",
      "src-1246-2",
      "src-1246-3",
      "src-1246-4",
      "src-1246-5"
    ],
    "confidence_per_field": null
  },
  "version": {
    "first_seen_at": "2025-09-20T09:00:00+02:00",
    "last_seen_at": "2025-09-28T12:17:00+02:00",
    "changed_at": "2025-09-28T12:17:00+02:00",
    "content_hash": "sha256:1246b2c3d4",
    "record_version": 2,
    "observation_state": "active"
  },
  "attachments": [],
  "change_type": "changed"
}
