{
  "schema_version": "1.0",
  "identity": {
    "internal_job_id": "job-1239",
    "source_job_id": "freep-88205",
    "canonical_url": "https://www.freep.nl/opdracht/88205",
    "source": "freep"
  },
  "core": {
    "title": "Backend Developer",
    "client_name": "TotalEnergies",
    "description_original": "Backend Developer voor API-platform.",
    "description_clean": "Backend Developer for an API platform."
  },
  "publication": {
    "publication_datetime": "2025-09-26T09:17:00+02:00",
    "closing_datetime": "2025-10-06T23:59:00+02:00",
    "timezone": "Europe/Amsterdam",
    "status": "open"
  },
  "delivery": {
    "location": "Tanger, Morocco",
    "remote_policy": "hybrid",
    "hours_min": 32,
    "hours_max": 40,
    "start_date": null,
    "end_date": null,
    "extension_options": null
  },
  "selection": {
    "hard_requirements": [
      {
        "text": "Minimaal 4 jaar ervaring met Java en Spring Boot",
        "evidence_ref": "src-1239-1"
      }
    ],
    "wishes": [
      {
        "text": "Ervaring met Kafka is een pre",
        "evidence_ref": "src-1239-2"
      }
    ],
    "award_criteria": [
      {
        "text": "CV (60%)",
        "evidence_ref": "src-1239-3"
      },
      {
        "text": "Interview (40%)",
        "evidence_ref": "src-1239-4"
      }
    ],
    "competencies": []
  },
  "profile": {
    "education": [],
    "experience": [],
    "skills": [
      "Java",
      "Spring Boot",
      "Kafka"
    ],
    "methods": [],
    "certifications": [],
    "languages": [
      "English"
    ]
  },
  "commercial": {
    "rate_min": 65,
    "rate_max": 85,
    "currency": "EUR",
    "vat_basis": null,
    "travel_cost_policy": null
  },
  "engagement": {
    "contract_type": "freelance",
    "zzp_allowed": true,
    "screening": null,
    "vog": null,
    "nationality_constraints": null,
    "supplier_conditions": null
  },
  "procedure": {
    "positions": 1,
    "max_candidates": null,
    "interview_window": null,
    "submission_instructions": null
  },
  "quality": {
    "completeness_status": "complete_within_scan_window",
    "validation_errors": [],
    "source_evidence": [
      "src-1239-1",
      "src-1239-2",
      "src-1239-3",
      "src-1239-4"
    ],
    "confidence_per_field": null
  },
  "version": {
    "first_seen_at": "2025-09-12T09:00:00+02:00",
    "last_seen_at": "2025-09-26T09:17:00+02:00",
    "changed_at": "2025-09-26T09:17:00+02:00",
    "content_hash": "sha256:1239c9d0e1",
    "record_version": 2,
    "observation_state": "active"
  },
  "attachments": [],
  "change_type": "changed"
}
